[
  {
    "id": "s-uci-har",
    "url": "https://archive.ics.uci.edu/dataset/240/human+activity+recognition+using+smartphones",
    "title": "UCI HAR (windowed edition)",
    "kind": "primary_resource",
    "accessed_on": "2026-09-28",
    "verification_method": "web_read",
    "note": "Relevant metadata sections checked; not a full methodological or clinical appraisal."
  },
  {
    "id": "s-hapt",
    "url": "https://archive.ics.uci.edu/dataset/341/smartphone+based+recognition+of+human+activities+and+postural+transitions",
    "title": "HAPT",
    "kind": "primary_resource",
    "accessed_on": "2026-09-28",
    "verification_method": "web_read",
    "note": "Relevant metadata sections checked; not a full methodological or clinical appraisal."
  },
  {
    "id": "s-pamap2",
    "url": "https://archive.ics.uci.edu/dataset/231/pamap2+physical+activity+monitoring",
    "title": "PAMAP2",
    "kind": "primary_resource",
    "accessed_on": "2026-09-28",
    "verification_method": "web_read",
    "note": "Relevant metadata sections checked; not a full methodological or clinical appraisal."
  },
  {
    "id": "s-opportunity",
    "url": "https://archive.ics.uci.edu/dataset/226/opportunity+activity+recognition",
    "title": "OPPORTUNITY",
    "kind": "primary_resource",
    "accessed_on": "2026-09-28",
    "verification_method": "web_read",
    "note": "Relevant metadata sections checked; not a full methodological or clinical appraisal."
  },
  {
    "id": "s-wisdm-watch",
    "url": "https://archive.ics.uci.edu/dataset/507/wisdm+smartphone+and+smartwatch+activity+and+biometrics+dataset",
    "title": "WISDM Smartphone and Smartwatch",
    "kind": "primary_resource",
    "accessed_on": "2026-09-28",
    "verification_method": "web_read",
    "note": "Relevant metadata sections checked; not a full methodological or clinical appraisal."
  },
  {
    "id": "s-wesad",
    "url": "https://archive.ics.uci.edu/dataset/465/wesad+wearable+stress+and+affect+detection",
    "title": "WESAD",
    "kind": "primary_resource",
    "accessed_on": "2026-09-28",
    "verification_method": "web_read",
    "note": "Relevant metadata sections checked; not a full methodological or clinical appraisal."
  },
  {
    "id": "s-ppg-dalia",
    "url": "https://archive.ics.uci.edu/dataset/495/ppg+dalia",
    "title": "PPG-DaLiA",
    "kind": "primary_resource",
    "accessed_on": "2026-09-28",
    "verification_method": "web_read",
    "note": "Relevant metadata sections checked; not a full methodological or clinical appraisal."
  },
  {
    "id": "s-mhealth",
    "url": "https://archive.ics.uci.edu/dataset/319/mhealth+dataset",
    "title": "MHEALTH",
    "kind": "primary_resource",
    "accessed_on": "2026-09-28",
    "verification_method": "web_read",
    "note": "Relevant metadata sections checked; not a full methodological or clinical appraisal."
  },
  {
    "id": "s-hhar",
    "url": "https://archive.ics.uci.edu/dataset/344/heterogeneity+activity+recognition",
    "title": "HHAR",
    "kind": "primary_resource",
    "accessed_on": "2026-09-28",
    "verification_method": "web_read",
    "note": "Relevant metadata sections checked; not a full methodological or clinical appraisal."
  },
  {
    "id": "s-daphnet",
    "url": "https://archive.ics.uci.edu/dataset/245/daphnet+freezing+of+gait",
    "title": "Daphnet Freezing of Gait",
    "kind": "primary_resource",
    "accessed_on": "2026-09-28",
    "verification_method": "web_read",
    "note": "Relevant metadata sections checked; not a full methodological or clinical appraisal."
  },
  {
    "id": "s-realdisp",
    "url": "https://archive.ics.uci.edu/dataset/305/realdisp+activity+recognition+dataset",
    "title": "REALDISP",
    "kind": "primary_resource",
    "accessed_on": "2026-09-28",
    "verification_method": "web_read",
    "note": "Relevant metadata sections checked; not a full methodological or clinical appraisal."
  },
  {
    "id": "s-harth",
    "url": "https://archive.ics.uci.edu/dataset/779/harth",
    "title": "HARTH",
    "kind": "primary_resource",
    "accessed_on": "2026-09-28",
    "verification_method": "web_read",
    "note": "Relevant metadata sections checked; not a full methodological or clinical appraisal."
  },
  {
    "id": "s-har70",
    "url": "https://archive.ics.uci.edu/dataset/780/har70",
    "title": "HAR70+",
    "kind": "primary_resource",
    "accessed_on": "2026-09-28",
    "verification_method": "web_read",
    "note": "Relevant metadata sections checked; not a full methodological or clinical appraisal."
  },
  {
    "id": "s-capture24",
    "url": "https://www.nature.com/articles/s41597-024-03960-3",
    "title": "CAPTURE-24",
    "kind": "primary_resource",
    "accessed_on": "2026-09-28",
    "verification_method": "web_read",
    "note": "Relevant metadata sections checked; not a full methodological or clinical appraisal."
  },
  {
    "id": "s-ukb-accelerometry",
    "url": "https://journals.plos.org/plosone/article?id=10.1371/journal.pone.0169649",
    "title": "UK Biobank accelerometry (2017 analysis)",
    "kind": "primary_resource",
    "accessed_on": "2026-09-28",
    "verification_method": "web_read",
    "note": "Relevant metadata sections checked; not a full methodological or clinical appraisal."
  },
  {
    "id": "s-nhanes-0304",
    "url": "https://wwwn.cdc.gov/Nchs/Data/Nhanes/Public/2003/DataFiles/PAXRAW_C.htm",
    "title": "NHANES 2003–2004 minute counts",
    "kind": "primary_resource",
    "accessed_on": "2026-09-28",
    "verification_method": "web_read",
    "note": "Relevant metadata sections checked; not a full methodological or clinical appraisal."
  },
  {
    "id": "s-nhanes-0506",
    "url": "https://wwwn.cdc.gov/Nchs/Data/Nhanes/Public/2005/DataFiles/PAXRAW_D.htm",
    "title": "NHANES 2005–2006 minute counts",
    "kind": "primary_resource",
    "accessed_on": "2026-09-28",
    "verification_method": "web_read",
    "note": "Relevant metadata sections checked; not a full methodological or clinical appraisal."
  },
  {
    "id": "s-nhanes-1112",
    "url": "https://wwwn.cdc.gov/Nchs/Data/Nhanes/Public/2011/DataFiles/PAX80_G.htm",
    "title": "NHANES 2011–2012 raw accelerometry",
    "kind": "primary_resource",
    "accessed_on": "2026-09-28",
    "verification_method": "web_read",
    "note": "Relevant metadata sections checked; not a full methodological or clinical appraisal."
  },
  {
    "id": "s-nhanes-1314",
    "url": "https://wwwn.cdc.gov/Nchs/Data/Nhanes/Public/2013/DataFiles/PAX80_H.htm",
    "title": "NHANES 2013–2014 raw accelerometry",
    "kind": "primary_resource",
    "accessed_on": "2026-09-28",
    "verification_method": "web_read",
    "note": "Relevant metadata sections checked; not a full methodological or clinical appraisal."
  },
  {
    "id": "s-nhanes-mims-1112",
    "url": "https://wwwn.cdc.gov/Nchs/Data/Nhanes/Public/2011/DataFiles/PAXMIN_G.htm",
    "title": "NHANES 2011–2012 MIMS summaries",
    "kind": "primary_resource",
    "accessed_on": "2026-09-28",
    "verification_method": "web_read",
    "note": "Relevant metadata sections checked; not a full methodological or clinical appraisal."
  },
  {
    "id": "s-allofus-fitbit-v8",
    "url": "https://www.nature.com/articles/s41591-026-04352-3",
    "title": "All of Us Fitbit (CDR v8)",
    "kind": "primary_resource",
    "accessed_on": "2026-09-28",
    "verification_method": "web_read",
    "note": "Relevant metadata sections checked; not a full methodological or clinical appraisal."
  },
  {
    "id": "s-allofus-api",
    "url": "https://support.researchallofus.org/hc/en-us/articles/20281023493908-Resources-for-Using-Fitbit-Data",
    "title": "All of Us Fitbit data types",
    "kind": "primary_resource",
    "accessed_on": "2026-09-28",
    "verification_method": "web_read",
    "note": "Relevant metadata sections checked; not a full methodological or clinical appraisal."
  },
  {
    "id": "s-sleep-edf-expanded",
    "url": "https://physionet.org/content/sleep-edfx/1.0.0/",
    "title": "Sleep-EDF Expanded",
    "kind": "primary_resource",
    "accessed_on": "2026-09-28",
    "verification_method": "web_read",
    "note": "Relevant metadata sections checked; not a full methodological or clinical appraisal."
  },
  {
    "id": "s-ptb-xl",
    "url": "https://physionet.org/content/ptb-xl/1.0.3/",
    "title": "PTB-XL",
    "kind": "primary_resource",
    "accessed_on": "2026-09-28",
    "verification_method": "web_read",
    "note": "Relevant metadata sections checked; not a full methodological or clinical appraisal."
  },
  {
    "id": "s-wrist-ppg-exercise",
    "url": "https://physionet.org/content/wrist/1.0.0/",
    "title": "Wrist PPG During Exercise",
    "kind": "primary_resource",
    "accessed_on": "2026-09-28",
    "verification_method": "web_read",
    "note": "Relevant metadata sections checked; not a full methodological or clinical appraisal."
  },
  {
    "id": "s-bidmc-ppg",
    "url": "https://physionet.org/content/bidmc/1.0.0/",
    "title": "BIDMC PPG and Respiration",
    "kind": "primary_resource",
    "accessed_on": "2026-09-28",
    "verification_method": "web_read",
    "note": "Relevant metadata sections checked; not a full methodological or clinical appraisal."
  },
  {
    "id": "s-motion-sense",
    "url": "https://github.com/mmalekzadeh/motion-sense",
    "title": "MotionSense",
    "kind": "primary_resource",
    "accessed_on": "2026-09-28",
    "verification_method": "web_read",
    "note": "Relevant metadata sections checked; not a full methodological or clinical appraisal."
  },
  {
    "id": "s-realworld",
    "url": "https://www.uni-mannheim.de/dws/research/projects/activity-recognition/dataset/dataset-realworld/",
    "title": "RealWorld HAR",
    "kind": "primary_resource",
    "accessed_on": "2026-09-28",
    "verification_method": "web_read",
    "note": "Relevant metadata sections checked; not a full methodological or clinical appraisal."
  },
  {
    "id": "s-gait-pd",